{
  "version": "9.4.1",
  "updated": "2026-06-08",
  "enums": {
    "area": [
      "work",
      "home",
      "self",
      "social"
    ],
    "status": [
      {
        "value": "🔴 to-do",
        "meaning": "Niet gestart"
      },
      {
        "value": "🟠 in progress",
        "meaning": "Actief"
      },
      {
        "value": "🔵 waiting",
        "meaning": "Geblokkeerd/extern"
      },
      {
        "value": "🟢 done",
        "meaning": "Afgerond"
      },
      {
        "value": "🟣 backlog",
        "meaning": "Toekomstig"
      },
      {
        "value": "⚫ cancelled",
        "meaning": "Geannuleerd"
      }
    ],
    "rating": [
      {
        "value": "s-tier",
        "meaning": "All-time favoriet, onvergetelijk"
      },
      {
        "value": "aanrader",
        "meaning": "Sterk, zeker kijken/lezen"
      },
      {
        "value": "prima",
        "meaning": "Oké, vermakelijk"
      },
      {
        "value": "tegenvaller",
        "meaning": "Viel tegen"
      }
    ],
    "pain_level": [
      "🟢 none",
      "🔵 tension",
      "🟠 mild",
      "🔴 severe"
    ],
    "chore_nature": [
      "obligation",
      "routine",
      "invest"
    ]
  },
  "core_fields": {
    "type": {
      "type": "string",
      "required": true,
      "description": "What IS this?"
    },
    "category": {
      "type": "string",
      "required": true,
      "description": "Which variant?"
    },
    "created": {
      "type": "date",
      "required": true,
      "pattern": "YYYY-MM-DD"
    },
    "slug": {
      "type": "string",
      "required": true,
      "description": "Unique identifier (kebab-case)"
    },
    "timestamp": {
      "type": "string",
      "required": true,
      "pattern": "YYYYMMDD-HHmm"
    }
  },
  "context_fields": {
    "area": {
      "type": "enum",
      "enum": "area",
      "description": "Which life domain?"
    },
    "project": {
      "type": "string",
      "description": "Short project code for retrieval and human queries, normally an abbreviation of the project name, e.g. bam. Must not duplicate project_slug when a separate project code exists."
    },
    "project_slug": {
      "type": "string",
      "description": "Canonical project note slug/filename stem for the project note, e.g. 2026-05-bam."
    },
    "entity": {
      "type": "array",
      "items": "string",
      "description": "Linked to whom/what?"
    },
    "topics": {
      "type": "array",
      "items": "string",
      "required_new": true,
      "non_empty_new": true,
      "description": "Discovery keywords"
    },
    "aliases": {
      "type": "array",
      "items": "string",
      "description": "Alternative names for Obsidian linking"
    },
    "source": {
      "type": "string",
      "required_new": true,
      "description": "Origin system (manual, codex-chat, telegram, apple-mail, imessage, browser)"
    },
    "source_id": {
      "type": "string",
      "description": "Stable source identifier for automated captures"
    },
    "thread_id": {
      "type": "string",
      "description": "Conversation/session/thread identifier for chat-like sources"
    },
    "reply_to": {
      "type": "string",
      "description": "Slug or source_id this note replies to"
    },
    "agent": {
      "type": "string",
      "description": "Agent that produced the captured answer when applicable"
    },
    "url": {
      "type": "string",
      "description": "External URL for web/reference captures"
    },
    "generated_from": {
      "type": "string_or_array",
      "description": "Source contract, note, or export that generated this artifact"
    },
    "sources": {
      "type": "array",
      "items": "string",
      "description": "Source paths, URLs, or source_ids used for compiled synthesis"
    },
    "source_hash": {
      "type": "string",
      "description": "Hash of raw/source content when drift detection is useful"
    },
    "source_hash_algorithm": {
      "type": "string",
      "description": "Hash algorithm for source_hash, usually sha256"
    },
    "source_checked_at": {
      "type": "string",
      "description": "Timestamp/date when the raw/source hash or URL was last checked"
    },
    "confidence": {
      "type": "string_or_number",
      "description": "Evidence confidence for generated/evidence notes; use high/medium/low or a numeric model confidence"
    },
    "contested": {
      "type": "boolean",
      "description": "True when the note contains unresolved contradiction or competing claims"
    },
    "contradictions": {
      "type": "array",
      "items": "string",
      "description": "Related slugs/paths/source_ids that conflict with this note"
    },
    "supersedes": {
      "type": "string_or_array",
      "description": "Older slugs/paths/source_ids this note replaces or materially updates"
    }
  },
  "folders": {
    "00_inbox/": {
      "purpose": "Legacy quarantine buffer for markdown notes that cannot yet be classified safely",
      "structure": "flat",
      "lifecycle": "legacy_quarantine"
    },
    "10_notes/": {
      "purpose": "The Brain (Chronological Timeline for events)",
      "structure": "YYYY-MM",
      "types": [
        "interaction",
        "purchase",
        "health",
        "entry",
        "task",
        "reference"
      ]
    },
    "20_files/": {
      "purpose": "The Records (Data & Assets in Timeline)",
      "structure": "YYYY-MM",
      "types": []
    },
    "30_media/": {
      "purpose": "The Memories (Excluded Binary Data)",
      "structure": "YYYY-MM"
    },
    "system/": {
      "purpose": "The Engine (Static rules & Structure)",
      "subfolders": {
        "entities": "system/entities/",
        "projects": "system/projects/",
        "chores": "system/chores/",
        "context": "system/context/",
        "contracts": "system/contracts/",
        "indexes": "system/indexes/",
        "memory": "system/memory/",
        "anniversaries": "system/anniversaries/"
      }
    }
  },
  "note_intake": {
    "default_creation_location": "canonical",
    "applies_to": [
      "interaction",
      "purchase",
      "health",
      "entry",
      "task",
      "reference",
      "entity",
      "anniversary",
      "project",
      "chore",
      "context"
    ],
    "filename": "use final filename pattern immediately",
    "promotion_required": false,
    "daily_log_required": true,
    "retention_rule": "New markdown notes are written directly to the canonical location declared under types.*.location when classification is clear.",
    "promotion_rule": "No standard promotion flow. 00_inbox is retained only for legacy/quarantine captures or explicit user request.",
    "quarantine_location": "00_inbox/",
    "quarantine_rule": "Use 00_inbox only when classification is uncertain, the capture flow is legacy, or the user explicitly requests inbox placement.",
    "exceptions": [
      "updates to existing notes",
      "daily note log updates",
      "daily operational records such as entry:daily and entry:eod",
      "schema, contract, and agent-instruction edits",
      "legacy/quarantine captures with unresolved classification"
    ]
  },
  "anchor_contract": {
    "new_or_changed_notes": {
      "required_fields": [
        "type",
        "category",
        "created",
        "slug",
        "timestamp",
        "area",
        "topics",
        "source"
      ],
      "required_context_anchor_any_of": [
        "entity",
        "project",
        "wikilink"
      ],
      "required_machine_anchor_any_of": [
        "source",
        "source_id",
        "url"
      ],
      "required_retrieval_anchor": "topics"
    },
    "source_rules": {
      "automated_sources": [
        "telegram",
        "telegram-agent",
        "telegram-voice",
        "apple-mail",
        "imessage",
        "teams",
        "safari-reading-list",
        "browser",
        "downloads"
      ],
      "conversational_sources": [
        "telegram",
        "telegram-agent",
        "telegram-voice",
        "imessage",
        "teams"
      ],
      "source_id_required_for": [
        "telegram",
        "telegram-agent",
        "telegram-voice",
        "apple-mail",
        "imessage",
        "teams",
        "safari-reading-list",
        "browser",
        "downloads"
      ],
      "thread_id_required_for": [
        "telegram",
        "telegram-agent",
        "telegram-voice",
        "imessage",
        "teams"
      ]
    },
    "type_rules": {
      "entity_required_for_types": [
        "interaction",
        "project"
      ],
      "project_required_when_project_bound": true
    },
    "project_identity_rules": {
      "project": "Short stable project code, usually the abbreviation in the project note's types.project.common_fields.code field.",
      "project_slug": "Canonical project note slug, equal to the filename stem under system/projects/.",
      "do_not_duplicate": "Do not set project and project_slug to the same value unless the project code intentionally equals the project note slug and no shorter code exists.",
      "example": {
        "project": "bam",
        "project_slug": "2026-05-bam"
      }
    }
  },
  "filename_patterns": {
    "default": "YYYYMMDD-HHmm-slug.md",
    "entity": "slug.md",
    "project": "YYYY-MM-slug.md",
    "anniversary": "MM-DD-category-entity.md",
    "chore": "category-frequency-slug.md"
  },
  "types": {
    "entity": {
      "location": "system/entities/",
      "filename": "{slug}.md",
      "description": "People, pets, companies, products, places",
      "categories": {
        "person": {
          "description": "Human contact",
          "fields": {
            "apple_contact_id": {
              "type": "string"
            },
            "first_name": {
              "type": "string"
            },
            "last_name": {
              "type": "string"
            },
            "phone": {
              "type": "string"
            },